{
  "case_id": "spring-boot-checkformat-batch5-v2-001",
  "repo": "spring-projects/spring-boot",
  "source": "github_actions",
  "framework": "generic",
  "failure_category": "lint_error",
  "raw_log_path": "raw.log",
  "line_count": 6275,
  "byte_size": 569317,
  "workflow_name": "Build Pull Request",
  "job_name": "Build Pull Request",
  "notes": "Spring Boot PR build (~16min). Gradle task `:module:spring-boot-actuator:checkFormatMain` failed because `src/main/java/org/springframework/boot/actuate/sbom/SbomProperties.java` has formatting violations. Late signal_position (failure summary at L6188-6195 of 6275, ~98%). Selected as Batch 5 case 1 — fills the v2 java-gradle ecosystem gap and is NOT in the calibration set used to tune hybrid-v2's 120k threshold. Source URL: https://github.com/spring-projects/spring-boot/actions/runs/25525927228/job/74921409232. Privacy audit: 0 hits, complete_scan=True. failure_category=lint_error (Gradle's checkFormat is a code-style lint rule); framework=generic because the runner is Gradle Build's Spring Boot meta-builder rather than tsc/jest/pytest/cargo enums."
}
