{
  "case_id": "numpy-pytest-segfault-argsort-v2-001",
  "repo": "numpy/numpy",
  "source": "github_actions",
  "framework": "pytest",
  "failure_category": "test_assertion",
  "raw_log_path": "raw.log",
  "line_count": 5553,
  "byte_size": 484493,
  "workflow_name": "Linux tests",
  "job_name": "smoke_test (3.12)",
  "notes": "Process-crash failure on numpy's `reverse-sorts` perf branch. test_datetime_nat_argsort_stability (test_datetime.py:226) calls argsort() on a NaT-containing datetime array; numpy's C extension segfaults; pytest faulthandler dumps a Python traceback and exits 245. Surface is `Fatal Python error: Segmentation fault` followed by a 30-line stack into _wrapfunc / argsort / the test. Different evidence shape from any v1.3 or prior v2 case (no assertion diff, no compile error block, no test framework FAIL marker — just a crash inside a test). Source URL: https://github.com/numpy/numpy/actions/runs/25480154290/job/74762267261. Imported on 2026-05-07."
}
