{
  "case_id": "cleanup-k8s-stress-001",
  "repo": "kubernetes/kubernetes",
  "source": "github_actions",
  "framework": "generic",
  "failure_category": "permission_or_secret",
  "raw_log_path": "raw.log",
  "line_count": 83,
  "byte_size": 5166,
  "workflow_name": "CI",
  "job_name": "Cleanup artifacts",
  "notes": "Post-job `gh api DELETE /repos/kubernetes/kubernetes/actions/artifacts/...` call returns HTTP 403 ('Resource not accessible by integration'). The GITHUB_TOKEN / app token scope used by the cleanup step is not allowed to delete workflow artifacts on this repo. Fix is workflow-level: adjust the token permissions block."
}
